category_slug,name,slug,sku,description,price,original_value,stock_quantity,weight_grams,is_available,is_active,is_featured,is_subscribable,image_url,brand,year,dimensions,players,power_watts,specs,connectivity,benefits
jeux-arcade,Borne Arcade Multi-Jeux 60-en-1,borne-arcade-multi-60,ESL-ARC-001,"Borne d'arcade multi-jeux avec 60 jeux classiques pré-chargés. Écran 32"" HD, monnayeur inclus. Idéale pour bar ou salle de jeux.",1290.00,1590.00,5,85000,true,true,true,false,https://example.com/images/borne-arcade-multi.jpg,Taito,2023,"65 x 75 x 175 cm",2,350,Écran 32" HD|60 jeux inclus|Monnayeur intégré|Haut-parleurs stéréo,USB|HDMI|Ethernet,Rentabilité rapide|Facile d'entretien|Certifié CE
jeux-arcade,Borne Cocktail Table 2 Joueurs,borne-cocktail-table,ESL-ARC-002,"Table arcade cocktail 2 joueurs face à face. Format bistrot, parfaite pour les cafés et restaurants.",890.00,,3,45000,true,true,false,false,https://example.com/images/cocktail-table.jpg,Raw Thrills,2022,"85 x 70 x 80 cm",2,200,Écran 26" encastré|2 joueurs face à face|Monnayeur optionnel|Surface en verre trempé,USB|HDMI,Format compact|Design bistrot|Certifié CE
flippers,Flipper Stern Deadpool Premium,flipper-stern-deadpool,ESL-FLP-001,"Flipper Stern Deadpool Premium Edition. Le meilleur flipper de sa génération avec affichage LCD et multiballs.",6490.00,6990.00,2,100000,true,true,true,false,https://example.com/images/stern-deadpool.jpg,Stern Pinball,2018,"56 x 143 x 191 cm",1,600,Affichage LCD couleur|Multiballs|Sons & lumières LED|Wi-Fi connecté,Wi-Fi|USB,Pièce maîtresse|Valeur patrimoniale|SAV Stern France
flippers,Flipper Medieval Madness Remake,flipper-medieval-madness,ESL-FLP-002,"Medieval Madness Remake par Chicago Gaming Company. Édition limitée, reproduction fidèle de l'iconique de 1997.",7990.00,,1,105000,true,true,true,false,https://example.com/images/medieval-madness.jpg,Chicago Gaming,2019,"56 x 143 x 191 cm",1,500,Reproduction fidèle de l'original|LED RGB|Mécanismes améliorés|Affichage HD,,Édition collector|Investissement sûr|Certifié CE
simulateurs,Simulateur Course Sit-Down Deluxe,simulateur-course-sit-down,ESL-SIM-001,"Simulateur de course Deluxe avec siège baquet, retour de force, pédales et écran 42"" courbe. Expérience immersive totale.",3490.00,3990.00,4,120000,true,true,true,false,https://example.com/images/sim-course-deluxe.jpg,Sega,2021,"130 x 110 x 160 cm",1,800,Siège baquet réglable|Retour de force|Écran 42" courbe|Pédales acier,USB|HDMI|Ethernet,Immersion totale|Multi-jeux|Certifié CE
simulateurs,Simulateur Moto GP Arcade,simulateur-moto-gp,ESL-SIM-002,"Simulateur moto GP avec guidon force feedback, siège inclinable et écran 55"". Titre officiel MotoGP.",4290.00,,2,140000,true,true,false,false,https://example.com/images/sim-moto-gp.jpg,Bandai Namco,2022,"100 x 80 x 180 cm",1,700,Guidon force feedback|Siège inclinable|Écran 55"|Licence MotoGP officielle,USB|HDMI,Réalisme maximal|Licence officielle|Certifié CE
billard-bar,Table Billard Américain 8 Pieds,table-billard-americain-8,ESL-BIL-001,"Table de billard américain 8 pieds professionnelle. Tapis tournoi, billes incluses, monnayeur optionnel.",1890.00,2200.00,6,180000,true,true,false,false,https://example.com/images/billard-americain.jpg,Brunswick,2023,"220 x 120 x 80 cm",4,0,Tapis tournoi|Billes professionnelles|Châssis acier|Monnayeur optionnel,,Robuste et durable|Norme tournoi|Certifié CE
billard-bar,Baby-Foot Professionnel Tornado,babyfoot-tornado-pro,ESL-BIL-002,"Baby-foot Tornado professionnel, le standard mondial des compétitions. Barres télescopiques, joueurs moulés.",890.00,,4,65000,true,true,false,false,https://example.com/images/babyfoot-tornado.jpg,Tornado,2023,"120 x 70 x 90 cm",4,0,Barres télescopiques|Joueurs moulés|Pieds antidérapants|Monnayeur optionnel,,Standard compétition|Référence mondiale|Certifié CE
